<?xml version="1.0" encoding="UTF-8" standalone="no" ?>
<!DOCTYPE sourcedocuments  PUBLIC "-//Paul Golder//DTD jcerttemplate2//EN" "http://lerot.org/Templates/jcerttemplate.dtd">

 <sourcedocuments>
   <sourcedocument>
     <template>
       <templateID>Census1851</templateID>
       <version>3</version>
       <stylesheet>../Stylesheets/EngCensus1851_stylesheet.xsl</stylesheet>
       <name>England Census 1851</name>
       <author>Paul A Golder</author>
       <editdate>3 feb 2013</editdate>
       <type>census</type>
       <country>England</country>
       <period>1851</period>
       <source>ONS image HO 107/1508 </source>
     </template>
     <certificate objecttype="certificate" name="main"   backgroundcolor="#D0F5A9" >
       <stylegroup name="xinput"  borderwidth="1" bordercolor="red" />
       <hgroup   >
         <label layout="MIDDLE" >Page</label>
         <input columns="4" target="pageno" />
         <label layout="RIGHT" >Sequence</label>
         <input columns="4" target="sequenceno"  />
       </hgroup>
       <table name="heading"    >
         <trow>
           <tcell>
             <label>Parish[or Township] of</label>
           </tcell>
           <tcell>
             <label>Ecclesiastical district of</label>
           </tcell>
           <tcell>
             <label>
               <text>City or Borough of</text>
             </label>
           </tcell>
           <tcell>
             <label>Town of</label>
           </tcell>
           <tcell>
             <label>Village of</label>
           </tcell>
         </trow>
         <trow name="headinput" >
           <tcell name="parish" >
             <input  name="parishinput"  target="parish"  />
           </tcell>
           <tcell>
             <input    target="ecclesiasticalDistrict"   />
           </tcell>
           <tcell>
             <input    target="borough"  />
           </tcell>
           <tcell>
             <input    target="town" />
           </tcell>
           <tcell>
             <input    target="village"   />
           </tcell>
         </trow>
       </table>
       <hgroup/>
       <table name="people"  objecttype="people"  borderwidth="1"   >
         <stylegroup name="xtrow"  borderwidth="1" bordercolor="red" />
         <stylegroup name="xinput"  borderwidth="1"  bordercolor="blue" backgroundcolor="silver" />
         <trow  >
           <tcell>
             <label  direction="vertical" fontsize="8" >
               <text>No of</text>
               <text>house-</text>
               <text>holders</text>
               <text>schedule</text>
             </label>
           </tcell>
           <tcell>
             <label>
               <text>Name of Street, Place, or</text>
               <text>Road, and Name or</text>
               <text> No. of House</text>
             </label>
           </tcell>
           <tcell>
             <label>
               <text>Name and Surname of each Person</text>
               <text>who abode in the house</text>
               <text>on the Night of the 30th March, 1851</text>
             </label>
           </tcell>
           <tcell>
             <label>
               <text>Relation</text>
               <text>to</text>
               <text>Head of Family</text>
             </label>
           </tcell>
           <tcell>
             <label>Condition</label>
           </tcell>
           <tcolumn colspan="2" >
             <tcell layout="FILLV" >
               <label >Age of</label>
             </tcell>
             <trow  >
               <tcell>
                 <label fontsize="8" >Males</label>
               </tcell>
               <tcell>
                 <label  fontsize="8" >Females</label>
               </tcell>
             </trow>
           </tcolumn>
           <tcell>
             <label>
               <text>Rank, Profession</text>
               <text>or Occupation</text>
             </label>
           </tcell>
           <tcell>
             <label>Where Born</label>
           </tcell>
           <tcell>
             <label>
               <text>Whether</text>
               <text>Blind or Deaf-</text>
               <text>-and-Dumb</text>
             </label>
           </tcell>
         </trow>
         <trow  rows ="10"  objecttype="person"  >
           <tcell>
             <input    target="householdReference"  />
           </tcell>
           <tcell>
             <input    target="address"  />
           </tcell>
           <tcell>
             <input    target="fullname"  />
           </tcell>
           <tcell>
             <input    target="roleInHousehold"  />
           </tcell>
           <tcell>
             <input    target="maritalStatus"  />
           </tcell>
           <tcell>
             <input  target="age:gender=male"  />
           </tcell>
           <tcell>
             <input  target="age:gender=female"  />
           </tcell>
           <tcell>
             <input    target="occupation"  />
           </tcell>
           <tcell>
             <input    target="birthplace"  />
           </tcell>
           <tcell>
             <input    target="note"  />
           </tcell>
         </trow>
         <trow   >
           <tcell  >
             <label   >Total of Houses  </label>
           </tcell>
           <tcell/>
           <tcell/>
           <tcell/>
           <tcell/>
           <tcell>
             <input  target="totalMales"  />
           </tcell>
           <tcell>
             <input  target="totalFemales"  />
           </tcell>
           <tcell/>
           <tcell/>
         </trow>
       </table>
     </certificate>
   </sourcedocument>
 </sourcedocuments>