<?xml version="1.0" encoding="UTF-8" standalone="no" ?>
<!DOCTYPE sourcedocuments  PUBLIC "-//Paul Golder//DTD jcerttemplate//EN" "http://lerot.org/Templates/jcerttemplate.dtd">

<sourcedocuments>
    <sourcedocument>
        <template>
            <templateID>westminstermarriage</templateID>
            <version>2</version>
            <stylesheet>../Stylesheets/WestminsterMarriageCert_stylesheet.xsl</stylesheet>
            <name>Copy of an entry of marriage St James Westminster</name>
            <savefilepattern>Marriages/Marriage_cert.xml</savefilepattern>
            <author>Paul A Golder</author>
            <editdate>8 feb 2013</editdate>
            <type>Marriage certificate</type>
            <country>England</country>
        </template>
        <certificate  objecttype="certificate" name="main"  backgroundcolor="#CEF6CE" >
            <styleblock name="input"  borderwidth="0"  columns="20" backgroundcolor="#C2C2C2"/>
            <vgroup name="heading"  >
                <hblock name="page"    >
                    <label layout="center"  font-size="20"    >Page</label>
                    <input target="pageNumber"  columns="4" />
                </hblock>
                
                <vgroup  name="title" >
                    <hblock  backgroundcolor="black" height="5" />
                    <hblock  >
                        <label  name="trace" layout="center"  font-size="20"   >MARRIAGES solemnized in the Parish of St. James Westminster</label>
                    </hblock>
                    <hblock>
                        <label layout="center"  font-size="20"  >in the County of Middlesex, in the Year</label>
                        <input   target="year"  font-size="20" columns="4" />
                    </hblock>
                </vgroup>
            </vgroup>
            <hgroup  name="dummy1" backgroundcolor="black" height="5" />
            <hgroup name="dummy2" height="50"  />
            <vgroup   name="marriage"  objecttype="marriage"  >
                <hblock >
                    <input height="20" layout="right"  target="groom.name"   columns="40" />
                    <label>of</label>
                    <input      target="groom.residence"  columns="5" />
                    <label>Parish</label>
                </hblock>
                <hblock  height="20" />
                <hblock>
                    <label>and</label>
                    <input height="10"  layout="right"   target="bride.name"  columns="40" />
                    <label>of</label>
                    <input      target="bride.residence"  columns="5" />
                    <label>Parish</label>
                </hblock>
                <hblock height="10" />
                <hblock>
                    <label>were married in this church by</label>
                    <input     target="banns"  columns="20" />
                    <label>with consent of</label>
                    <input      target="consent"  columns="20" />
                </hblock>
                <hblock height="10" />
                <hblock>
                    <label>this</label>
                    <input      target="day" />
                    <label>Day of</label>
                    <input      target="month" />
                    <label>in the Year One thousand eight hundred and thirty two</label>
                </hblock>
                <hblock height="10" />
                <hblock>
                    <label layout="center" >By me</label>
                    <input width="40"  target="official"  />
                </hblock>
                <hblock height="10" />
                <vgroup  borderwidth="1" bordercolor="blue" >
                    <hblock   >
                        <hblock layout="left" >
                            <label>This marriage was solemized between us</label>
                            <label font-size="40" >{</label>
                        </hblock>
                        <vblock tgap="10">
                            <input      target="groom.name" />
                            <hblock height="5" />
                            <input      target="bride.name" />
                        </vblock>
                    </hblock>
                    <hgroup  >
                        <hblock   layout="right" >
                            <label>in the presence of</label>
                            <label font-size="40" >{</label>
                        </hblock>
                        <vblock layout="FILLW" tgap="10" >
                            <input      target="witness.first" />
                            <hblock height="5" />
                            <input      target="witness.second" />
                        </vblock>
                    </hgroup>
                </vgroup>
            </vgroup>
        </certificate>
    </sourcedocument>
</sourcedocuments>
