<?xml version="1.0" encoding="UTF-8" standalone="no"  ?>
<!DOCTYPE sourcedocuments  PUBLIC "-//Paul Golder//DTD jcerttemplate//EN" "http://lerot.org/Templates/jcerttemplate.dtd">

<sourcedocuments>
    <sourcedocument>
        <template>
            <templateID>Census1871-0.1</templateID>
            <stylesheet>Stylesheets/EngCensus1871_stylesheet.xsl</stylesheet>
            <name>England Census 1871</name>
            <author>Paul A Golder</author>
            <editdate>16 april 2009</editdate>
            <type>census</type>
            <country>England</country>
            <period>1871</period>
            <source>gro</source>
        </template>
        <certificate  objecttype="certificate" name="main"  backgroundcolor="#D0F5A9" >
            <styleblock name="inputcell"  borderwidth="0"  backgroundcolor="#E4DCDC"  />
            <vgroup borderwidth="1" >
                <hblock>
                    <label >the undermentioned Houses are situate within the Boundaries of the</label>     
                </hblock>
            </vgroup>
            <table name="heading"   >
                <trow>
                    <tcell>
                        <label>Civil Parish[or Township] of</label>
                    </tcell> 
                    <tcell>
                        <label>
                            <text>City or</text>
                            <text>Municipal Borough of</text>
                        </label>
                    </tcell>
                    <tcell>
                        <label>
                            <text>MunicipalWard of</text>
                        </label>
                    </tcell>
                    <tcell>
                        <label>Parliamentary Borough of</label>
                    </tcell>
                    <tcell>
                        <label>Town of</label>
                    </tcell>
                    <tcell>
                        <label>Village or Hamlet of</label>
                    </tcell>
                    <tcell>
                        <label>
                            <text>Local Board or [Improvement</text>
                            <text>Commissioners District] of</text>
                        </label>
                    </tcell>
                    <tcell>
                        <label>Ecclesiastical district of</label>
                    </tcell>
                </trow>
                <trow>
                    <tcell>
                        <input    target="parish"  />
                    </tcell> 
                    <tcell>
                        <input    target="municipalBorough"  />
                    </tcell>
                    <tcell>
                        <input    target="ward"  />
                    </tcell>
                    <tcell>
                        <input    target="parliamentaryBorough" />
                    </tcell>
                    <tcell>
                        <input    target="town"   />
                    </tcell>
                    <tcell>
                        <input    target="hamlet"  />
                    </tcell>
                    <tcell>
                        <input    target="localBoard"  />
                    </tcell>
                    <tcell>
                        <input    target="ecclesiasticalDistrict"   />
                    </tcell>
                </trow>
            </table>
            <hgroup/>
            <table name="people"  objecttype="people" borderwidth="1"  >
                <trow  >
                    <tcell>
                        <label>
                            <text>No of</text>
                            <text>Schedule</text>
                        </label>
                    </tcell>
                    <tcell>
                        <label>
                            <text>ROAD, STREET etc </text>
                            <text>and No or NAME of HOUSE</text>
                        </label>
                    </tcell>
                    <tcell>
                        <label colspan="2" align="center" >Houses </label>
                        <label  width="30" font-size="8">
                            <text>In-</text>
                            <text>habit-</text>
                            <text>ed </text>
                        </label>
                    </tcell>
                    <tcell>
                        <label></label>
                        <label width="30"  font-size="8">
                            <text>unin-</text>
                            <text>habited</text>
                            <text>(U.). or</text>
                            <text>Building</text>
                            <text>(B.).</text>
                        </label>
                    </tcell>
                    <tcell>
                        <label>
                            <text>NAME and Surname of Each</text>
                            <text>Person</text>
                        </label>
                    </tcell>
                    <tcell>
                        <label>
                            <text>RELATION</text>
                            <text>to Head</text>
                            <text>of Family</text>
                        </label>
                    </tcell>
                    <tcell>
                        <label><text>CON-</text>
                            <text>DITION</text>
                        </label>
                    </tcell>
                    <tcell>
                        <label colspan="2">
                            <text>AGE</text>
                            <text>of</text>
                        </label>
                        <label font-size="8" width="20" >Males</label>
                    </tcell>
                    <tcell>
                        <label/>
                        <label  font-size="8"  width="20" >Females</label>
                    </tcell>
                    <tcell>
                        <label>Rank, Profession, or OCCUPATION</label>
                    </tcell>
                    <tcell>
                        <label>WHERE BORN</label>
                    </tcell>
                    <tcell>
                        <label>
                            <text>Whether</text>
                            <text>1. Deaf and Dumb</text>
                            <text>2. Blind </text>
                            <text>3. Imbecile or Idiot </text>
                            <text>4. Lunatic </text>
                        </label>
                    </tcell>
                </trow>
                <trow rows ="25" objecttype="person"  backgroundcolor="#E4DCDC" borderwidth="0" >
                    <tcell>
                        <input    target="householdReference"  />
                    </tcell>
                    <tcell>
                        <input    target="address"  />
                    </tcell>
                    <tcell>
                        <input    target="inhabitedHouse"  />
                    </tcell>
                    <tcell>
                        <input    target="uninhabitedHouse"  />
                    </tcell>
                    <tcell>
                        <input    target="fullname"  />
                    </tcell>
                    <tcell>
                        <input    target="roleInHousehold"  />
                    </tcell>
                    <tcell>
                        <input    target="maritalStatus"  />
                    </tcell>
                    <tcell>
                        <input  target="age:gender=male"  />
                    </tcell>
                    <tcell>
                        <input    target="age:gender=female"  />
                    </tcell>
                    <tcell>
                        <input    target="occupation"  />
                    </tcell>
                    <tcell>
                        <input    target="birthplace"  />
                    </tcell>
                    <tcell>
                        <input    target="note"  />
                    </tcell>
                </trow>
                <trow>
                    <tcell>
                        <label colspan="2">Total of Houses  </label>
                    </tcell>
                    <tcell/>
                    <tcell>
                        <input  target="totalInhabited"  />
                    </tcell>
                    <tcell>
                        <input  target="totalUninhabited"  />
                    </tcell>
                    <tcell>
                        <label colspan="3">Total of Males and Females </label>
                    </tcell>
                    <tcell/>
                    <tcell/>
                    <tcell>
                        <input  target="totalMales"  />
                    </tcell>
                    <tcell>
                        <input  target="totalFemales"  />
                    </tcell>
                    <tcell/>
                    <tcell/>
                    <tcell/>
                </trow>
            </table>
        </certificate>
    </sourcedocument>
</sourcedocuments>
